{
    "schemaVersion":  "1.0.0",
    "taskId":  "mcp-probe-20261026-131627",
    "backend":  "matlab-mcp-existing",
    "matlabVersion":  "26.1.0.3276743 Update 3",
    "matlabRelease":  "R2026a",
    "startedAt":  "2026-10-26T13:16:27+08:00",
    "finishedAt":  "2026-10-26T13:16:27+08:00",
    "environment":  {
                        "os":  "Microsoft Windows NT 10.0.26100.0",
                        "hostName":  "LIULIYE",
                        "matlabInstalled":  true,
                        "matlabExecutable":  "E:\\matlab\\bin\\matlab.exe",
                        "powerShellVersion":  "5.1.26100.7462"
                    },
    "toolboxInventory":  [

                         ],
    "checks":  [
                   {
                       "id":  "mcp.matlab-install",
                       "title":  "MATLAB ��װ�ɽ���",
                       "level":  "L1",
                       "status":  "PASS",
                       "command":  "Resolve-MatlabExecutable",
                       "exitCode":  null,
                       "startedAt":  null,
                       "finishedAt":  null,
                       "durationSeconds":  null,
                       "metrics":  {
                                       "executable":  "E:\\matlab\\bin\\matlab.exe",
                                       "versionInfo":  "E:\\matlab\\VersionInfo.xml",
                                       "version":  "26.1.0.3276743",
                                       "release":  "R2026a",
                                       "versionReadable":  true
                                   },
                       "reason":  null,
                       "errorClass":  null,
                       "artifactPaths":  [

                                         ],
                       "sourceReport":  null,
                       "retry":  null
                   },
                   {
                       "id":  "mcp.matlab-license",
                       "title":  "MATLAB ���֤����",
                       "level":  "L1",
                       "status":  "SKIP",
                       "command":  null,
                       "exitCode":  null,
                       "startedAt":  null,
                       "finishedAt":  null,
                       "durationSeconds":  null,
                       "metrics":  {

                                   },
                       "reason":  "���ֻ֤��ͨ����� MATLAB ��֤��δָ�� -VerifyLicense���ʲ��������֤����",
                       "errorClass":  null,
                       "artifactPaths":  [

                                         ],
                       "sourceReport":  null,
                       "retry":  null
                   },
                   {
                       "id":  "mcp.session-config",
                       "title":  "MCP �Ự�ļ��ɽ���",
                       "level":  "L1",
                       "status":  "SKIP",
                       "command":  null,
                       "exitCode":  null,
                       "startedAt":  null,
                       "finishedAt":  null,
                       "durationSeconds":  null,
                       "metrics":  {
                                       "sessionFile":  "sessionDetails.json",
                                       "sessionFileSha256":  "EAAFF3AEEAD3B8ADF286080DFA9BF389CE065C43CBF252F4A843234786A03C64",
                                       "exists":  true,
                                       "parsed":  true,
                                       "port":  31519,
                                       "hasApiKey":  true,
                                       "apiKeyLength":  48,
                                       "certificate":  "C:\\Users\\23201\\AppData\\Roaming\\MathWorks\\MATLAB\\R2026a\\thisMatlab.pem",
                                       "certificateExists":  true,
                                       "pid":  42820,
                                       "pidAlive":  false,
                                       "processName":  null,
                                       "note":  "�Ự�ļ��� PID ���ֻ˵�����ô��ڣ������� MCP Э�����"
                                   },
                       "reason":  "�Ự PID 42820 �Ѳ����ڣ��Ự�ļ����ڣ������¹���Ự",
                       "errorClass":  null,
                       "artifactPaths":  [

                                         ],
                       "sourceReport":  null,
                       "retry":  null
                   },
                   {
                       "id":  "mcp.client-registration",
                       "title":  "�ͻ��� MCP ע������Ϸ�",
                       "level":  "L2",
                       "status":  "SKIP",
                       "command":  null,
                       "exitCode":  null,
                       "startedAt":  null,
                       "finishedAt":  null,
                       "durationSeconds":  null,
                       "metrics":  {
                                       "total":  0,
                                       "valid":  0,
                                       "violationCount":  0,
                                       "missingCommand":  0,
                                       "clients":  [

                                                   ],
                                       "entries":  [

                                                   ]
                                   },
                       "reason":  "δ���ְ��� \u0027matlab-official\u0027 ����Чע�ᣨ��� Codex / Claude / VS Code / .mcp.json��",
                       "errorClass":  null,
                       "artifactPaths":  [

                                         ],
                       "sourceReport":  null,
                       "retry":  null
                   },
                   {
                       "id":  "mcp.protocol-handshake",
                       "title":  "MCP Э�����֣�initialize��",
                       "level":  "L2",
                       "status":  "SKIP",
                       "command":  null,
                       "exitCode":  null,
                       "startedAt":  null,
                       "finishedAt":  null,
                       "durationSeconds":  null,
                       "metrics":  {
                                       "endpoint":  null,
                                       "tcpReachable":  false,
                                       "protocolVersion":  null,
                                       "serverName":  null
                                   },
                       "reason":  "�׶� 2 δ�������ûỰ��SKIP�����Ự PID 42820 �Ѳ����ڣ��Ự�ļ����ڣ������¹���Ự",
                       "errorClass":  null,
                       "artifactPaths":  [

                                         ],
                       "sourceReport":  null,
                       "retry":  null
                   },
                   {
                       "id":  "mcp.readonly-exec",
                       "title":  "ֻ��������ʵִ��",
                       "level":  "L3",
                       "status":  "SKIP",
                       "command":  null,
                       "exitCode":  null,
                       "startedAt":  null,
                       "finishedAt":  null,
                       "durationSeconds":  null,
                       "metrics":  {
                                       "tool":  null,
                                       "toolCount":  0,
                                       "output":  null,
                                       "expectedPattern":  "\\d+\\.\\d+"
                                   },
                       "reason":  "�׶� 3 δͨ�����޷�ִ��ֻ������",
                       "errorClass":  null,
                       "artifactPaths":  [

                                         ],
                       "sourceReport":  null,
                       "retry":  null
                   },
                   {
                       "id":  "mcp.file-io",
                       "title":  "����Ŀ¼�ļ�д����ض�",
                       "level":  "L4",
                       "status":  "SKIP",
                       "command":  null,
                       "exitCode":  null,
                       "startedAt":  null,
                       "finishedAt":  null,
                       "durationSeconds":  null,
                       "metrics":  {
                                       "directory":  "D:\\Temp\\mas-s2-acceptance-e7de31f2477d473da80cc4847fd37bb2\\clean-install\\project\\artifacts\\validation\\mcp_io_probe",
                                       "token":  null,
                                       "echoed":  null,
                                       "hostVerified":  false
                                   },
                       "reason":  "���ν׶�δͨ����handshake=SKIP, readonly=SKIP����δִ���ļ���д��֤",
                       "errorClass":  null,
                       "artifactPaths":  [
                                             "D:\\Temp\\mas-s2-acceptance-e7de31f2477d473da80cc4847fd37bb2\\clean-install\\project\\artifacts\\validation\\mcp_io_probe"
                                         ],
                       "sourceReport":  null,
                       "retry":  null
                   }
               ],
    "summary":  {
                    "total":  7,
                    "pass":  1,
                    "fail":  0,
                    "skip":  6
                },
    "overallStatus":  "SKIP",
    "achievedLevel":  "L0",
    "limitations":  [
                        "�׶� 1b�����֤��Ĭ�� SKIP��ֻ��ָ�� -VerifyLicense ʱ����� MATLAB У�顣",
                        "�׶� 3~5 ������ʵ MCP server ��ʵ��ϸ�ڣ��˵�·������Ȩͷ������������δƥ��ʱ��� FAIL/SKIP ������ԭ�򣬲������ PASS��"
                    ],
    "unexecuted":  [

                   ]
}