{
  "schemaVersion": "1.0.0",
  "taskId": "mcp-probe-20261026-202407",
  "backend": "matlab-mcp-existing",
  "matlabVersion": "26.1.0.3276743 Update 3",
  "matlabRelease": "R2026a",
  "startedAt": "2026-10-26T20:24:07+08:00",
  "finishedAt": "2026-10-26T20:24:09+08:00",
  "environment": {
    "os": "Microsoft Windows NT 10.0.26100.0",
    "hostName": "LIULIYE",
    "matlabInstalled": true,
    "matlabExecutable": "E:\\matlab\\bin\\matlab.exe",
    "powerShellVersion": "7.6.9"
  },
  "toolboxInventory": [],
  "checks": [
    {
      "id": "mcp.matlab-install",
      "title": "MATLAB 安装可解析",
      "level": "L1",
      "status": "PASS",
      "command": "Resolve-MatlabExecutable",
      "exitCode": null,
      "startedAt": null,
      "finishedAt": null,
      "durationSeconds": null,
      "metrics": {
        "executable": "E:\\matlab\\bin\\matlab.exe",
        "versionInfo": "E:\\matlab\\VersionInfo.xml",
        "version": "26.1.0.3276743",
        "release": "R2026a",
        "versionReadable": true
      },
      "reason": null,
      "errorClass": null,
      "artifactPaths": [],
      "sourceReport": null,
      "retry": null
    },
    {
      "id": "mcp.matlab-license",
      "title": "MATLAB 许可证可用",
      "level": "L1",
      "status": "PASS",
      "command": null,
      "exitCode": null,
      "startedAt": null,
      "finishedAt": null,
      "durationSeconds": null,
      "metrics": {
        "provenBy": "mcp.readonly-exec",
        "note": "通过共享会话真实执行 disp(version)，证明 MATLAB 已授权且可运行"
      },
      "reason": null,
      "errorClass": null,
      "artifactPaths": [],
      "sourceReport": null,
      "retry": null
    },
    {
      "id": "mcp.session-config",
      "title": "MCP 会话文件可解析",
      "level": "L1",
      "status": "PASS",
      "command": null,
      "exitCode": null,
      "startedAt": null,
      "finishedAt": null,
      "durationSeconds": null,
      "metrics": {
        "sessionFile": "sessionDetails.json",
        "sessionFileSha256": "086321AAD1A5645A084CFA872F0ADAB0275E23195640E5E88E342FD7410E6991",
        "exists": true,
        "parsed": true,
        "port": 31520,
        "hasApiKey": true,
        "apiKeyLength": 16,
        "certificate": "C:\\Users\\23201\\AppData\\Roaming\\MathWorks\\MATLAB\\R2026a\\thisMatlab.pem",
        "certificateExists": true,
        "pid": 42956,
        "pidAlive": true,
        "processName": "MATLAB",
        "note": "会话文件与 PID 存活只说明配置存在，不代表 MCP 协议可用"
      },
      "reason": null,
      "errorClass": null,
      "artifactPaths": [],
      "sourceReport": null,
      "retry": null
    },
    {
      "id": "mcp.client-registration",
      "title": "客户端 MCP 注册参数合法",
      "level": "L2",
      "status": "PASS",
      "command": null,
      "exitCode": null,
      "startedAt": null,
      "finishedAt": null,
      "durationSeconds": null,
      "metrics": {
        "total": 1,
        "valid": 1,
        "violationCount": 0,
        "missingCommand": 0,
        "clients": [
          "generic"
        ],
        "entries": [
          {
            "client": "generic",
            "source": "D:\\Temp\\mas-s3-project\\.mcp.json",
            "command": "E:\\desktop\\MATLAB\\bin\\matlab-mcp-server-windows-x64.exe",
            "args": [
              "--matlab-session-mode=existing"
            ],
            "valid": true,
            "commandExists": true,
            "violations": []
          }
        ]
      },
      "reason": null,
      "errorClass": null,
      "artifactPaths": [],
      "sourceReport": null,
      "retry": null
    },
    {
      "id": "mcp.protocol-handshake",
      "title": "MCP 协议握手（initialize）",
      "level": "L2",
      "status": "PASS",
      "command": "stdio: E:\\desktop\\MATLAB\\bin\\matlab-mcp-server-windows-x64.exe --matlab-session-mode=existing --disable-telemetry=true -> initialize",
      "exitCode": null,
      "startedAt": null,
      "finishedAt": null,
      "durationSeconds": null,
      "metrics": {
        "transport": "stdio",
        "transportNote": null,
        "serverExe": "E:\\desktop\\MATLAB\\bin\\matlab-mcp-server-windows-x64.exe",
        "serverOrigin": "registration:generic",
        "serverIntegrity": "VERIFIED_AGAINST_MANIFEST",
        "serverVerified": true,
        "serverRelease": "v0.15.0",
        "serverSha256": "A1F67DD917C5731F88399E1671EBE4F6959D2FD520C78DCAA1FAF3AD37EA9518",
        "sessionMode": "existing",
        "endpoint": null,
        "tcpReachable": false,
        "protocolVersion": "2025-06-18",
        "serverName": "matlab-mcp-server",
        "tlsMode": "stdio",
        "pinnedThumbprint": null,
        "httpStatus": null,
        "durationMs": 547,
        "skippedLines": 0,
        "serverVersion": "github.com/matlab/matlab-mcp-server v0.15.0"
      },
      "reason": null,
      "errorClass": null,
      "artifactPaths": [],
      "sourceReport": null,
      "retry": null
    },
    {
      "id": "mcp.readonly-exec",
      "title": "只读命令真实执行",
      "level": "L3",
      "status": "PASS",
      "command": "stdio: tools/call evaluate_matlab_code",
      "exitCode": null,
      "startedAt": null,
      "finishedAt": null,
      "durationSeconds": null,
      "metrics": {
        "tool": "evaluate_matlab_code",
        "toolCount": 5,
        "output": "26.1.0.3276743 (R2026a) Update 3\n",
        "expectedPattern": "\\d+\\.\\d+",
        "tools": [
          "check_matlab_code",
          "detect_matlab_toolboxes",
          "evaluate_matlab_code",
          "run_matlab_file",
          "run_matlab_test_file"
        ],
        "durationMs": 207
      },
      "reason": null,
      "errorClass": null,
      "artifactPaths": [],
      "sourceReport": null,
      "retry": null
    },
    {
      "id": "mcp.file-io",
      "title": "隔离目录文件写入与回读",
      "level": "L4",
      "status": "PASS",
      "command": "stdio: tools/call evaluate_matlab_code (write+read)",
      "exitCode": null,
      "startedAt": null,
      "finishedAt": null,
      "durationSeconds": null,
      "metrics": {
        "directory": "D:\\Temp\\mas-s3-7-auto-existing-1e08a9d3d78748dfac575a206bba1618\\artifacts\\validation\\mcp_io_probe",
        "token": "c7d1e27e56f34710b620102ec0a09878",
        "echoed": "c7d1e27e56f34710b620102ec0a09878\n",
        "hostVerified": true,
        "file": "D:\\Temp\\mas-s3-7-auto-existing-1e08a9d3d78748dfac575a206bba1618\\artifacts\\validation\\mcp_io_probe\\io_probe_c7d1e27e56f34710b620102ec0a09878.txt",
        "hostContent": "c7d1e27e56f34710b620102ec0a09878",
        "fileBytes": 32
      },
      "reason": null,
      "errorClass": null,
      "artifactPaths": [
        "D:\\Temp\\mas-s3-7-auto-existing-1e08a9d3d78748dfac575a206bba1618\\artifacts\\validation\\mcp_io_probe"
      ],
      "sourceReport": null,
      "retry": null
    }
  ],
  "summary": {
    "total": 7,
    "pass": 7,
    "fail": 0,
    "skip": 0
  },
  "overallStatus": "PASS",
  "achievedLevel": "L4",
  "limitations": [
    "阶段 1b（许可证）默认 SKIP：只有指定 -VerifyLicense 时才启动 MATLAB 校验。",
    "阶段 3~5 依赖真实 MCP server 的实现细节（端点路径、鉴权头、工具名）；未匹配时输出 FAIL/SKIP 并给出原因，不会偽造 PASS。",
    "stdio 通道已在本探针结束时关闭（exit=0, forced=False）；本次探测未下载任何二进制。"
  ],
  "unexecuted": []
}