{
    "schemaVersion":  "1.0.0",
    "taskId":  "mcp-probe-20261026-134915",
    "backend":  "matlab-mcp-existing",
    "matlabVersion":  "26.1.0.3276743 Update 3",
    "matlabRelease":  "R2026a",
    "startedAt":  "2026-10-26T13:49:15+08:00",
    "finishedAt":  "2026-10-26T13:49:16+08:00",
    "environment":  {
                        "os":  "Microsoft Windows NT 10.0.26100.0",
                        "hostName":  "LIULIYE",
                        "matlabInstalled":  true,
                        "matlabExecutable":  "E:\\matlab\\bin\\matlab.exe",
                        "powerShellVersion":  "5.1.26100.7462"
                    },
    "toolboxInventory":  [

                         ],
    "checks":  [
                   {
                       "id":  "mcp.matlab-install",
                       "title":  "MATLAB 安装可解析",
                       "level":  "L1",
                       "status":  "PASS",
                       "command":  "Resolve-MatlabExecutable",
                       "exitCode":  null,
                       "startedAt":  null,
                       "finishedAt":  null,
                       "durationSeconds":  null,
                       "metrics":  {
                                       "executable":  "E:\\matlab\\bin\\matlab.exe",
                                       "versionInfo":  "E:\\matlab\\VersionInfo.xml",
                                       "version":  "26.1.0.3276743",
                                       "release":  "R2026a",
                                       "versionReadable":  true
                                   },
                       "reason":  null,
                       "errorClass":  null,
                       "artifactPaths":  [

                                         ],
                       "sourceReport":  null,
                       "retry":  null
                   },
                   {
                       "id":  "mcp.matlab-license",
                       "title":  "MATLAB 许可证可用",
                       "level":  "L1",
                       "status":  "SKIP",
                       "command":  null,
                       "exitCode":  null,
                       "startedAt":  null,
                       "finishedAt":  null,
                       "durationSeconds":  null,
                       "metrics":  {

                                   },
                       "reason":  "许可证只能通过启动 MATLAB 验证；未指定 -VerifyLicense，故不声称许可证可用",
                       "errorClass":  null,
                       "artifactPaths":  [

                                         ],
                       "sourceReport":  null,
                       "retry":  null
                   },
                   {
                       "id":  "mcp.session-config",
                       "title":  "MCP 会话文件可解析",
                       "level":  "L1",
                       "status":  "PASS",
                       "command":  null,
                       "exitCode":  null,
                       "startedAt":  null,
                       "finishedAt":  null,
                       "durationSeconds":  null,
                       "metrics":  {
                                       "sessionFile":  "sessionDetails.json",
                                       "sessionFileSha256":  "8A1A66B396CEB223D9C912447BB061E55D37BEB1238B74D6ED761CCA059A9D7A",
                                       "exists":  true,
                                       "parsed":  true,
                                       "port":  31519,
                                       "hasApiKey":  true,
                                       "apiKeyLength":  48,
                                       "certificate":  "C:\\Users\\23201\\AppData\\Roaming\\MathWorks\\MATLAB\\R2026a\\thisMatlab.pem",
                                       "certificateExists":  true,
                                       "pid":  7008,
                                       "pidAlive":  true,
                                       "processName":  "MATLAB",
                                       "note":  "会话文件与 PID 存活只说明配置存在，不代表 MCP 协议可用"
                                   },
                       "reason":  null,
                       "errorClass":  null,
                       "artifactPaths":  [

                                         ],
                       "sourceReport":  null,
                       "retry":  null
                   },
                   {
                       "id":  "mcp.client-registration",
                       "title":  "客户端 MCP 注册参数合法",
                       "level":  "L2",
                       "status":  "SKIP",
                       "command":  null,
                       "exitCode":  null,
                       "startedAt":  null,
                       "finishedAt":  null,
                       "durationSeconds":  null,
                       "metrics":  {
                                       "total":  0,
                                       "valid":  0,
                                       "violationCount":  0,
                                       "missingCommand":  0,
                                       "clients":  [

                                                   ],
                                       "entries":  [

                                                   ]
                                   },
                       "reason":  "未发现包含 \u0027matlab-official\u0027 的有效注册（检查 Codex / Claude / VS Code / .mcp.json）",
                       "errorClass":  null,
                       "artifactPaths":  [

                                         ],
                       "sourceReport":  null,
                       "retry":  null
                   },
                   {
                       "id":  "mcp.protocol-handshake",
                       "title":  "MCP 协议握手（initialize）",
                       "level":  "L2",
                       "status":  "FAIL",
                       "command":  "POST https://127.0.0.1:31519/mcp (initialize)",
                       "exitCode":  null,
                       "startedAt":  null,
                       "finishedAt":  null,
                       "durationSeconds":  null,
                       "metrics":  {
                                       "endpoint":  "https://127.0.0.1:31519/mcp",
                                       "tcpReachable":  true,
                                       "protocolVersion":  null,
                                       "serverName":  null,
                                       "httpStatus":  null,
                                       "durationMs":  122
                                   },
                       "reason":  "传输层错误：基础连接已经关闭: 未能为 SSL/TLS 安全通道建立信任关系。",
                       "errorClass":  "MCP_CONNECTION_ERROR",
                       "artifactPaths":  [

                                         ],
                       "sourceReport":  null,
                       "retry":  null
                   },
                   {
                       "id":  "mcp.readonly-exec",
                       "title":  "只读命令真实执行",
                       "level":  "L3",
                       "status":  "SKIP",
                       "command":  null,
                       "exitCode":  null,
                       "startedAt":  null,
                       "finishedAt":  null,
                       "durationSeconds":  null,
                       "metrics":  {
                                       "tool":  null,
                                       "toolCount":  0,
                                       "output":  null,
                                       "expectedPattern":  "\\d+\\.\\d+"
                                   },
                       "reason":  "阶段 3 未通过，无法执行只读命令",
                       "errorClass":  null,
                       "artifactPaths":  [

                                         ],
                       "sourceReport":  null,
                       "retry":  null
                   },
                   {
                       "id":  "mcp.file-io",
                       "title":  "隔离目录文件写入与回读",
                       "level":  "L4",
                       "status":  "SKIP",
                       "command":  null,
                       "exitCode":  null,
                       "startedAt":  null,
                       "finishedAt":  null,
                       "durationSeconds":  null,
                       "metrics":  {
                                       "directory":  "D:\\Temp\\mas-s2-acceptance-98b1dce463a74964badfa980213c4530\\clean-install\\project\\artifacts\\validation\\mcp_io_probe",
                                       "token":  null,
                                       "echoed":  null,
                                       "hostVerified":  false
                                   },
                       "reason":  "上游阶段未通过（handshake=FAIL, readonly=SKIP），未执行文件读写验证",
                       "errorClass":  null,
                       "artifactPaths":  [
                                             "D:\\Temp\\mas-s2-acceptance-98b1dce463a74964badfa980213c4530\\clean-install\\project\\artifacts\\validation\\mcp_io_probe"
                                         ],
                       "sourceReport":  null,
                       "retry":  null
                   }
               ],
    "summary":  {
                    "total":  7,
                    "pass":  2,
                    "fail":  1,
                    "skip":  4
                },
    "overallStatus":  "FAIL",
    "achievedLevel":  "L0",
    "limitations":  [
                        "阶段 1b（许可证）默认 SKIP：只有指定 -VerifyLicense 时才启动 MATLAB 校验。",
                        "阶段 3~5 依赖真实 MCP server 的实现细节（端点路径、鉴权头、工具名）；未匹配时输出 FAIL/SKIP 并给出原因，不会偽造 PASS。"
                    ],
    "unexecuted":  [

                   ]
}