{
    "schemaVersion":  "1.0.0",
    "taskId":  "mcp-probe-20261026-125116",
    "backend":  "matlab-mcp-existing",
    "matlabVersion":  "",
    "matlabRelease":  "",
    "startedAt":  "2026-10-26T12:51:16+08:00",
    "finishedAt":  "2026-10-26T12:51:20+08:00",
    "environment":  {
                        "os":  "Microsoft Windows NT 10.0.26100.0",
                        "hostName":  "LIULIYE",
                        "matlabInstalled":  false,
                        "matlabExecutable":  "",
                        "powerShellVersion":  "5.1.26100.7462"
                    },
    "toolboxInventory":  [

                         ],
    "checks":  [
                   {
                       "id":  "mcp.matlab-install",
                       "title":  "MATLAB 安装可解析",
                       "level":  "L1",
                       "status":  "FAIL",
                       "command":  null,
                       "exitCode":  null,
                       "startedAt":  null,
                       "finishedAt":  null,
                       "durationSeconds":  null,
                       "metrics":  {

                                   },
                       "reason":  "未找到 matlab 可执行文件（MATLAB_EXE / PATH / MATLAB_ROOT 均未命中）",
                       "errorClass":  "ENVIRONMENT_ERROR",
                       "artifactPaths":  [

                                         ],
                       "sourceReport":  null,
                       "retry":  null
                   },
                   {
                       "id":  "mcp.matlab-license",
                       "title":  "MATLAB 许可证可用",
                       "level":  "L1",
                       "status":  "SKIP",
                       "command":  null,
                       "exitCode":  null,
                       "startedAt":  null,
                       "finishedAt":  null,
                       "durationSeconds":  null,
                       "metrics":  {

                                   },
                       "reason":  "许可证只能通过启动 MATLAB 验证；未指定 -VerifyLicense，故不声称许可证可用",
                       "errorClass":  null,
                       "artifactPaths":  [

                                         ],
                       "sourceReport":  null,
                       "retry":  null
                   },
                   {
                       "id":  "mcp.session-config",
                       "title":  "MCP 会话文件可解析",
                       "level":  "L1",
                       "status":  "PASS",
                       "command":  null,
                       "exitCode":  null,
                       "startedAt":  null,
                       "finishedAt":  null,
                       "durationSeconds":  null,
                       "metrics":  {
                                       "sessionFile":  "fake-session.json",
                                       "sessionFileSha256":  "3729238BC115C044F5898B35B9AD9EDC2C409B7CF900BA67333D318AF18E8221",
                                       "exists":  true,
                                       "parsed":  true,
                                       "port":  1,
                                       "hasApiKey":  true,
                                       "apiKeyLength":  39,
                                       "certificate":  "E:\\desktop\\MATLAB\\artifacts\\s2\\pre-fix\\fake-cert.pem",
                                       "certificateExists":  true,
                                       "pid":  28100,
                                       "pidAlive":  true,
                                       "processName":  "powershell",
                                       "note":  "会话文件与 PID 存活只说明配置存在，不代表 MCP 协议可用"
                                   },
                       "reason":  null,
                       "errorClass":  null,
                       "artifactPaths":  [

                                         ],
                       "sourceReport":  null,
                       "retry":  null
                   },
                   {
                       "id":  "mcp.client-registration",
                       "title":  "客户端 MCP 注册参数合法",
                       "level":  "L2",
                       "status":  "SKIP",
                       "command":  null,
                       "exitCode":  null,
                       "startedAt":  null,
                       "finishedAt":  null,
                       "durationSeconds":  null,
                       "metrics":  {
                                       "total":  0,
                                       "valid":  0,
                                       "violationCount":  0,
                                       "missingCommand":  0,
                                       "clients":  [

                                                   ],
                                       "entries":  [

                                                   ]
                                   },
                       "reason":  "未发现包含 \u0027matlab-official\u0027 的有效注册（检查 Codex / Claude / VS Code / .mcp.json）",
                       "errorClass":  null,
                       "artifactPaths":  [

                                         ],
                       "sourceReport":  null,
                       "retry":  null
                   },
                   {
                       "id":  "mcp.protocol-handshake",
                       "title":  "MCP 协议握手（initialize）",
                       "level":  "L2",
                       "status":  "FAIL",
                       "command":  "POST https://127.0.0.1:1/mcp (initialize)",
                       "exitCode":  null,
                       "startedAt":  null,
                       "finishedAt":  null,
                       "durationSeconds":  null,
                       "metrics":  {
                                       "endpoint":  "https://127.0.0.1:1/mcp",
                                       "tcpReachable":  false,
                                       "protocolVersion":  null,
                                       "serverName":  null
                                   },
                       "reason":  "TCP 无法连接 127.0.0.1:1：MCP server 未监听",
                       "errorClass":  "MCP_CONNECTION_ERROR",
                       "artifactPaths":  [

                                         ],
                       "sourceReport":  null,
                       "retry":  null
                   },
                   {
                       "id":  "mcp.readonly-exec",
                       "title":  "只读命令真实执行",
                       "level":  "L3",
                       "status":  "SKIP",
                       "command":  null,
                       "exitCode":  null,
                       "startedAt":  null,
                       "finishedAt":  null,
                       "durationSeconds":  null,
                       "metrics":  {
                                       "tool":  null,
                                       "toolCount":  0,
                                       "output":  null,
                                       "expectedPattern":  "\\d+\\.\\d+"
                                   },
                       "reason":  "阶段 3 未通过，无法执行只读命令",
                       "errorClass":  null,
                       "artifactPaths":  [

                                         ],
                       "sourceReport":  null,
                       "retry":  null
                   },
                   {
                       "id":  "mcp.file-io",
                       "title":  "隔离目录文件写入与回读",
                       "level":  "L4",
                       "status":  "SKIP",
                       "command":  null,
                       "exitCode":  null,
                       "startedAt":  null,
                       "finishedAt":  null,
                       "durationSeconds":  null,
                       "metrics":  {
                                       "directory":  "E:\\desktop\\MATLAB\\artifacts\\s2\\pre-fix\\entry-only\\artifacts\\validation\\mcp_io_probe",
                                       "token":  null,
                                       "echoed":  null,
                                       "hostVerified":  false
                                   },
                       "reason":  "调用方要求跳过阶段 5",
                       "errorClass":  null,
                       "artifactPaths":  [
                                             "E:\\desktop\\MATLAB\\artifacts\\s2\\pre-fix\\entry-only\\artifacts\\validation\\mcp_io_probe"
                                         ],
                       "sourceReport":  null,
                       "retry":  null
                   }
               ],
    "summary":  {
                    "total":  7,
                    "pass":  1,
                    "fail":  2,
                    "skip":  4
                },
    "overallStatus":  "FAIL",
    "achievedLevel":  "L0",
    "limitations":  [
                        "阶段 1b（许可证）默认 SKIP：只有指定 -VerifyLicense 时才启动 MATLAB 校验。",
                        "阶段 3~5 依赖真实 MCP server 的实现细节（端点路径、鉴权头、工具名）；未匹配时输出 FAIL/SKIP 并给出原因，不会偽造 PASS。"
                    ],
    "unexecuted":  [

                   ]
}