{
  "schemaVersion": "1.0.0",
  "taskId": "task-C3-pid",
  "backend": "matlab-mcp-auto",
  "matlabVersion": "26.1.0.3276743 (R2026a) Update 3",
  "matlabRelease": "R2026a",
  "startedAt": "2026-10-23T14:47:52+08:00",
  "finishedAt": "2026-10-23T14:47:52+08:00",
  "environment": {
    "os": "Microsoft Windows NT 10.0.26100.0",
    "hostName": "LIULIYE",
    "matlabInstalled": true,
    "matlabExecutable": "E:/matlab/bin/matlab.exe",
    "powerShellVersion": "7.6.8"
  },
  "toolboxInventory": [
    {
      "name": "MATLAB",
      "licensed": true,
      "version": "26.1"
    },
    {
      "name": "Control System Toolbox",
      "licensed": true,
      "licenseFeature": "Control_Toolbox",
      "version": "26.1"
    }
  ],
  "checks": [
    {
      "id": "pid.artifacts",
      "title": "输出文件及 JSON 字段回读校验",
      "level": "L1",
      "status": "PASS",
      "command": "design_pid(); jsondecode(fileread(resultPath))",
      "exitCode": 0,
      "startedAt": null,
      "finishedAt": null,
      "durationSeconds": null,
      "metrics": {
        "Kp": 5.6000000000000005,
        "Ki": 9.9,
        "Kd": 0.1,
        "overshootPercent": 4.974848376564633,
        "settlingTimeSeconds": 1.5049239629437805
      },
      "reason": null,
      "errorClass": null,
      "artifactPaths": [
        "result.json",
        "design_pid.m",
        "artifacts/figures/pid_step.png",
        "artifacts/data/pid_step.mat",
        "artifacts/logs/pid_simulation.log"
      ],
      "sourceReport": null,
      "retry": null
    },
    {
      "id": "pid.analytical-response",
      "title": "阶跃仿真与独立解析解交叉校核",
      "level": "L3",
      "status": "PASS",
      "command": "result = design_pid();",
      "exitCode": 0,
      "startedAt": null,
      "finishedAt": null,
      "durationSeconds": null,
      "metrics": {
        "relativeTolerance": 1E-09,
        "absoluteTolerance": 1E-09,
        "referenceSettlingTimeSeconds": 1.5049239615665486,
        "maxAbsoluteError": 1.4654943925052066E-13,
        "referenceOvershootPercent": 4.974848401448412
      },
      "reason": null,
      "errorClass": null,
      "artifactPaths": [
        "artifacts/validation/simulation_evidence.json"
      ],
      "sourceReport": null,
      "retry": null
    },
    {
      "id": "pid.performance",
      "title": "超调量及 2% 调节时间严格达标",
      "level": "L3",
      "status": "PASS",
      "command": "stepinfo(response,time,1,0,SettlingTimeThreshold=0.02)",
      "exitCode": 0,
      "startedAt": null,
      "finishedAt": null,
      "durationSeconds": null,
      "metrics": {
        "settlingTimeSeconds": 1.5049239629437805,
        "overshootLimitExclusive": 10,
        "settlingBand": 0.02,
        "settlingTimeLimitExclusive": 2,
        "overshootPercent": 4.974848376564633
      },
      "reason": null,
      "errorClass": null,
      "artifactPaths": [],
      "sourceReport": null,
      "retry": null
    },
    {
      "id": "pid.code-review",
      "title": "实现复核及 MATLAB 静态分析零问题",
      "level": "L1",
      "status": "PASS",
      "command": "mcp__matlab_official__check_matlab_code(design_pid.m)",
      "exitCode": 0,
      "startedAt": null,
      "finishedAt": null,
      "durationSeconds": null,
      "metrics": {
        "issueCount": 0
      },
      "reason": null,
      "errorClass": null,
      "artifactPaths": [
        "artifacts/validation/code_analysis.json"
      ],
      "sourceReport": null,
      "retry": null
    }
  ],
  "summary": {
    "total": 4,
    "pass": 4,
    "fail": 0,
    "skip": 0
  },
  "overallStatus": "PASS",
  "achievedLevel": "L1",
  "limitations": [],
  "unexecuted": []
}